{
  "schema": "banco.topic/1",
  "schema_version": 1,
  "subject": "math",
  "key": "ripasso.math.demo-equations",
  "lesson_revision": 41,
  "practice": [
    {
      "skill": "math.demo-equation",
      "items": [
        {
          "item": "math-p-demo-1",
          "revision": "latest"
        },
        {
          "item": "math-p-demo-2",
          "revision": "latest"
        }
      ]
    }
  ]
}
